{
  "$schema": "http://json-schema.org/draft-07/schema#",
  "title": "Agent Configuration Schema",
  "description": "JSON schema for declarative agent configuration in Tandem",
  "type": "object",
  "properties": {
    "$schema": {
      "description": "The schema to verify this agent configuration against",
      "type": "string",
      "format": "uri-reference"
    },
    "agentId": {
      "type": "string",
      "description": "Unique identifier for the agent"
    },
    "name": {
      "type": "string",
      "description": "Human-readable name for the agent"
    },
    "description": {
      "type": "string",
      "description": "Description of the agent's purpose and capabilities"
    },
    "goal": {
      "type": "string",
      "description": "Primary goal or objective of the agent"
    },
    "model": {
      "type": "string",
      "description": "The AI model to use for this agent",
      "enum": [
        "gemini-2.0-flash-lite",
        "gemini-2.5-flash",
        "gemini-2.5-flash-lite-preview-06-17",
        "gemini-2.5-flash-preview-04-17",
        "gemini-2.5-flash-preview-05-20",
        "gemini-2.5-pro",
        "gemini-2.5-pro-preview-05-06",
        "gemini-2.5-pro-preview-06-05"
      ]
    },
    "instructions": {
      "type": "array",
      "description": "Array of instruction strings that define the agent's behavior",
      "items": {
        "type": "string"
      }
    },
    "tools": {
      "type": "array",
      "description": "Array of tools available to the agent",
      "uniqueItems": true,
      "items": {
        "$ref": "#/definitions/Tool"
      }
    }
  },
  "required": [
    "goal",
    "description",
    "instructions",
    "tools"
  ],
  "additionalProperties": false,
  "definitions": {
    "Tool": {
      "type": "string",
      "description": "Tool definition for agent capabilities",
      "enum": [
        "docker_exec"
      ]
    }
  }
}